{
  "description": "a component operator compiles to its own namespaced action, opaque to the kernel — with no protobuf component loaded, the engine reports the unknown action by name, at the path it was applied to, rather than silently ignoring the node (shape spec section 3.7). Since plan task 8.4 a namespaced action is run by whichever declared component contributes it (matcher/apply); with none in scope, that is the failure.",
  "input": {
    "kind": "spec",
    "spec": {
      "description": "a protobuf-encoded status",
      "parts": {
        "response": {
          "body": { "shape": "protobuf:enum", "example": "SHIPPED", "extra": true }
        }
      }
    }
  },
  "values": { "$.response.body": "SHIPPED" },
  "result": {
    "status": "mismatched",
    "mismatches": [
      {
        "path": "$.response.body",
        "message": "no component in scope contributes the action 'protobuf:enum'",
        "action": "protobuf:enum"
      }
    ]
  }
}
